DIRECT,"toggles direct on(per track), led is toggled on must use home to exit. while sequencer is running if this mode is toggled on the user may touch a step button and the sequencer will just to that step. if button is help sequencer will repeat step until it is let  go. if the sequencer is stopped the user may just press buttons sounding each one of them at a time.",nothing,nothing,"toggles direct on(per sequence), led flashes must use home to exit. while sequencer is  the user may touch a step button and the all tracks  will jump to that step. if button is help sequencer will repeat steps until it is let  go. if the sequencer is stopped the user may just press a button sounding every step in that ""column"".",,does not play steps that are toggled off. whic can be use to insert rests live,
CC,while being held user may push turn encoders to set midi channel and turn encoder to set CC number/ this allows the user to turn these knobs and send cc messages out of the unit when no other buttons are being pressed or latched. only applies to top 16 encoders,"when CC is being held each button on the step grid 1-128 sends out a midi cc of that value. when cc mode is togged on(flashing state)allows the user to draw a shape that is sent to a CC which can be assigned by the top oled. the CC is sent out on the track midi channel. in the future these shapes will be able to be saved into the shape ""list""",nothing,turns CC mode on which allows the user to sequence 16 midi CCs per step. in this mode the midi channel is ignored and the CC number and value is written to the step and is sent on the number the channel or step is set to,not applicable ,,
,,,,,,,
BUTTONS below lower encoder matrix,ENGAGED ALONE,"ENGAGED WITH ""TRACK"" BUTTON","ENGAGED WITH ""STEP"" BUTTON","ENGAGED WITH ""CQ""BUTTON",PUSH or PUSH TURN (encoders only),NOTES,VALUES
HOME,if you are in any toggled state this just immediately takes you to the default/home screen. led flashes when button can be used,,,,,,
PIANO,toggles on piano edit mode led stays lit. only way to escape is pressing home button,"when toggled on this selects the row/track being edited. if the track is 16 steps or less track selects the track, if more than sixteen steps the track buttons select the row. when more than 16 steps user may hold the button and the track you are editing illuminutes if you press another track it will switch to editing that track ",if there is an insteption it opens it for PIANO ROLL style editing. if there is not an insteption it creates one and opens it up in that way,"loops the area you are in. led blinks this shortcut toggles on ""focus mode""",hold button while pressing oct up or down to shift the base midi note of each row 12 midi notes,when this is engaged the grid becomes like a piano roll editor. the default is as follows:                                   tracks/rows 1-16 are equal to midi note numbers 57-72 (A3-C5). white keys and black keys should be two different led colors.,
ANALOG,toggles on analog edit mode. only way to escape this is to press home button,"when toggled on this selects the row/track being edited. if the track is 16 steps or less track selects the track, if more than sixteen steps the track buttons select the row. when more than 16 steps user may hold the button and the track you are editing illuminutes if you press another track it will switch to editing that track ",if there is an insteption it opens it for analog style editing. if there is not an insteption it creates one and opens it up in that way,"loops the area you are in. led blinks this shortcut toggles on ""focus mode"". presseing analog button again simply ends the focus mode",hold button while pressing oct up or down to shift the base midi note of each row 12 midi notes,"this is an edit mode that allows the user to turn the encoders to changes values on steps of selected tracks.  when it opens the default is turning the encoder changes the note value, pushing the enoder toggles the step off and on. in order to change what the encoders are editing the user may select the attribute by engaging the touch screen and turning a knob. the encoder light to same color of track they are editing and the chaselight is reflected there as well.",